example_id,module,movie,essay_question,movie_details,student_essay,grade,teacher_feedback,grade_category,stratum
M2_001,2,Perfect Secret,"The Perfect Secret is a German adaptation of an Italian film called Perfetti Sconosciuti. The Italian original has made history by being adapted into at least 18 different languages besides German (https://www.imdb.com/list/ls082389916/Links to an external site.), such as Arabic, French, Korean, Greek, Turkish, Chinese, etc. Why does the topic/theme seem to have such universal applicability, i.e. fit into so many different cultural contexts? Please cite a scene and situation in the film that you think is particularly true-for-all relationships, either romantic relationships or friendships. Indicate, using a time stamp, where in the film this comes up (e.g., Video 2 at 12 min 30 seconds).","The perfect secret is a 2019 German film comedy by director and screenwriter Bora Dagtekin.

The ensemble film is a remake of the Italian cinema film Perfetti Sconosciuti (about ""completely unknown"") by Paolo Genovese from 2016, which has already been remade in numerous countries. It is about seven friends who, at a dinner together, put their trust to the test by agreeing to share all the messages and calls received on their mobile phones during the meal with those present.

KammerspielThe tragicomic chamber play was produced by Constantin Film Production. In addition to Lena Schömann, Dagtekin also appeared as a producer. The filming took place between January and March 2019 in Munich and Geretsried. Karoline Herfurth, Elyas M'Barek, Florian David Fitz, Jella Haase, Frederick Lau, Jessica Schwarz and Wotan Wilke Möhring were committed to the cast. The German-wide release in the cinema took place on 31. October 2019. Among critics, the perfect secret came across a mixed echo.
Action

The couple Eva and Rocco invite their friends to dinner in their Munich attic apartment. Even before the guests arrive, there is a dispute between therapist Eva and her teenage daughter Sophie, after Eva found condoms in their pocket and confronted them. Sophie, who is on her way to her boyfriend Mike and has an increasingly tense relationship with her controlled mother, sees herself patronized again by Eva. Father Rocco, who can mediate between the two, meanwhile, employs something completely different: While the hobby chef is approached with the preparation of the food, he receives revealing selfies of an acquaintance on his mobile phone. Eva, who has been quietly observing her husband for a long time, is suspicious, but does not know about it.

First, the couple arrives Carlotta and Leo. Leo, who has put his career as a construction draftsman in favor of his wife, who has been working in an advertising agency again since the birth of the twins, is struggling with his fate as a house husband and full-time father. Carlotta, on the other hand, feels pushed into the second row: The copywriter, who usually works late into the evening and is rarely at home, has a distanced relationship with her children. The two will be accompanied by Bianca and Simon. Unlike Carlotta and Leo, the animal health practitioner and the life artist are freshly in love and strive for a trusting relationship with each other. However, Bianca, the youngest in the league, has only recently met Simon's longtime friends and occasionally feels ridiculed by the others.

After the high school teacher Pepe has arrived without his also expected and supposedly sick friend Anna and has placed his brought telescope to the sighting of the lunar eclipse announced for the night on the balcony, the group takes a seat in the dining room. At Rocco's inedible food and abundant wine, they begin to discuss the issue of honesty exuberantly. Without further ado, they want to put their mutual trust to the test and engage in a game conceived by Eva: Everyone must share all activities that run via their smartphone with those present. While Carlotta and Bianca immediately show themselves enthusiastic about the idea, the men only hesitantly agree with the project.

What should initially become a harmless game among friends quickly causes a glare: Leo, who has an affair with a playground acquaintance, expects a revealing photo of this and asks Pepe to exchange the mobile phones with him to cover up the matter. However, when Leo has to go to Pepe's phone in return, Pepe's contact reports to Hannes, whose ambiguities suggest to the others that he is sleeping with Leo. While Leo's supposed bisexuality, which he does not deny for fear of becoming aware of his actual affair with his friends, encounters incomprehension, Carlotta falls out of all the clouds and gets drunk. When she receives a clear voicemail from her colleague, she is forced to admit a drug problem triggered by the career pressure in her friends.

Pepe dissolves the farce when he confesses to the exchange action and reveals to the others his homosexuality, which has been concealed for many years, for which he is discriminated against by a father at his school and had expected incomprehension from his friends. Simon, meanwhile, receives a call from his colleague, who tells him to be pregnant by him. Bianca is deeply struck by the news and breaks with him immediately. Eva, who is secretly also having an affair with Simon, slaps him in the absence of the others and does the same. The guests then leave the apartment separately. Eva and Rocco, who are left alone, are looking for the conversation on the balcony and reconciling each other - but without telling the other about their own affair.

Some time after dinner, Leo and Carlotta have also found each other again and also opted for a role exchange: While he is pursuing a job offer, Carlotta now takes care of the two children full-time. In order to prove their friendship to the insulted Pepe, Rocco, Leo and Simon, meanwhile, beat up the father of Pepe's student, who then steers in and settles the conflict he provokes. The four childhood friends reconcile and travel together. When a ringing sounds along the way, Rocco draws an old-fashioned two-phone and confirms the other his affair. While Pepe, Leo and Simon try to snatch the device from him, Rocco throws the mobile phone into the Isar. ","I found the movie The Perfect Secret very interesting, which made me want to watch more. I even watched it more than once because I began to notice small details that indicated there were secrets between all of the friends from the very beginning. For example, the earrings Simon gave to Eva, or the photos Rocco received at the beginning, may have been related to his profession as a plastic surgeon. However, this is never fully explained, even though he is shown with a second cellphone at the end of the movie.

I find this topic and theme universal because cellphones are such an important part of our daily lives. Eva, who is a psychologist, mentions this idea at 17 minutes and 20 seconds into the movie, explaining that our phones contain GPS data, search history, blogs, messages, photos, location information, and personal details. This is when she states that everyone has something to hide and proposes a game called “Coming Clean.”

I found this relatable because most relationships are built on trust, but nobody is perfect, and some people do have things they keep hidden. Many relationships end because a partner searches the other’s phone and finds something unsettling. I also found this personally relatable because my wife and I have access to each other’s phones and have searched through them in the past. However, after many years, we grew to trust one another and slowly stopped doing that. We now have no problem with the other person using our phone, and have nothing to hide.

Overall, this movie sheds light on how people behave in the world today and how dependent we are on technology, especially our cellphones. It shows what could happen if someone took our phone and decided to go through it. Whether it is a friend, partner, or a stranger, the information on our devi",100.0,"
Hi Daxton,

You provided a strong personal connection to the theme, sharing how you and your wife navigated trust and phone privacy. This personal insight was the highlight of your essay. 

Excellent job on this! ",High,maximum
M2_002,2,Perfect Secret,"The Perfect Secret is a German adaptation of an Italian film called Perfetti Sconosciuti. The Italian original has made history by being adapted into at least 18 different languages besides German (https://www.imdb.com/list/ls082389916/Links to an external site.), such as Arabic, French, Korean, Greek, Turkish, Chinese, etc. Why does the topic/theme seem to have such universal applicability, i.e. fit into so many different cultural contexts? Please cite a scene and situation in the film that you think is particularly true-for-all relationships, either romantic relationships or friendships. Indicate, using a time stamp, where in the film this comes up (e.g., Video 2 at 12 min 30 seconds).","The perfect secret is a 2019 German film comedy by director and screenwriter Bora Dagtekin.

The ensemble film is a remake of the Italian cinema film Perfetti Sconosciuti (about ""completely unknown"") by Paolo Genovese from 2016, which has already been remade in numerous countries. It is about seven friends who, at a dinner together, put their trust to the test by agreeing to share all the messages and calls received on their mobile phones during the meal with those present.

KammerspielThe tragicomic chamber play was produced by Constantin Film Production. In addition to Lena Schömann, Dagtekin also appeared as a producer. The filming took place between January and March 2019 in Munich and Geretsried. Karoline Herfurth, Elyas M'Barek, Florian David Fitz, Jella Haase, Frederick Lau, Jessica Schwarz and Wotan Wilke Möhring were committed to the cast. The German-wide release in the cinema took place on 31. October 2019. Among critics, the perfect secret came across a mixed echo.
Action

The couple Eva and Rocco invite their friends to dinner in their Munich attic apartment. Even before the guests arrive, there is a dispute between therapist Eva and her teenage daughter Sophie, after Eva found condoms in their pocket and confronted them. Sophie, who is on her way to her boyfriend Mike and has an increasingly tense relationship with her controlled mother, sees herself patronized again by Eva. Father Rocco, who can mediate between the two, meanwhile, employs something completely different: While the hobby chef is approached with the preparation of the food, he receives revealing selfies of an acquaintance on his mobile phone. Eva, who has been quietly observing her husband for a long time, is suspicious, but does not know about it.

First, the couple arrives Carlotta and Leo. Leo, who has put his career as a construction draftsman in favor of his wife, who has been working in an advertising agency again since the birth of the twins, is struggling with his fate as a house husband and full-time father. Carlotta, on the other hand, feels pushed into the second row: The copywriter, who usually works late into the evening and is rarely at home, has a distanced relationship with her children. The two will be accompanied by Bianca and Simon. Unlike Carlotta and Leo, the animal health practitioner and the life artist are freshly in love and strive for a trusting relationship with each other. However, Bianca, the youngest in the league, has only recently met Simon's longtime friends and occasionally feels ridiculed by the others.

After the high school teacher Pepe has arrived without his also expected and supposedly sick friend Anna and has placed his brought telescope to the sighting of the lunar eclipse announced for the night on the balcony, the group takes a seat in the dining room. At Rocco's inedible food and abundant wine, they begin to discuss the issue of honesty exuberantly. Without further ado, they want to put their mutual trust to the test and engage in a game conceived by Eva: Everyone must share all activities that run via their smartphone with those present. While Carlotta and Bianca immediately show themselves enthusiastic about the idea, the men only hesitantly agree with the project.

What should initially become a harmless game among friends quickly causes a glare: Leo, who has an affair with a playground acquaintance, expects a revealing photo of this and asks Pepe to exchange the mobile phones with him to cover up the matter. However, when Leo has to go to Pepe's phone in return, Pepe's contact reports to Hannes, whose ambiguities suggest to the others that he is sleeping with Leo. While Leo's supposed bisexuality, which he does not deny for fear of becoming aware of his actual affair with his friends, encounters incomprehension, Carlotta falls out of all the clouds and gets drunk. When she receives a clear voicemail from her colleague, she is forced to admit a drug problem triggered by the career pressure in her friends.

Pepe dissolves the farce when he confesses to the exchange action and reveals to the others his homosexuality, which has been concealed for many years, for which he is discriminated against by a father at his school and had expected incomprehension from his friends. Simon, meanwhile, receives a call from his colleague, who tells him to be pregnant by him. Bianca is deeply struck by the news and breaks with him immediately. Eva, who is secretly also having an affair with Simon, slaps him in the absence of the others and does the same. The guests then leave the apartment separately. Eva and Rocco, who are left alone, are looking for the conversation on the balcony and reconciling each other - but without telling the other about their own affair.

Some time after dinner, Leo and Carlotta have also found each other again and also opted for a role exchange: While he is pursuing a job offer, Carlotta now takes care of the two children full-time. In order to prove their friendship to the insulted Pepe, Rocco, Leo and Simon, meanwhile, beat up the father of Pepe's student, who then steers in and settles the conflict he provokes. The four childhood friends reconcile and travel together. When a ringing sounds along the way, Rocco draws an old-fashioned two-phone and confirms the other his affair. While Pepe, Leo and Simon try to snatch the device from him, Rocco throws the mobile phone into the Isar. ","To be honest, I had to watch The Perfect Secret not once, but twice. The first time, I
was not interested in the movie and had to take a break for two days. I didn't really give it a
chance, but the second time around, I decided to take notes and really try and focus on the
characters, and wow, did I make a mistake the first time! I fell in love with Bianca; from the
moment she talked to Pepe out on the patio about how to know if you are in love. She had
such an open mind and was such a sweetheart. She was definitely too good for Simon in
my opinion. I thought it was very interesting how Eva wanted to play this game, I knew from
the start it was just to see if her husband had been cheating on her, but I don't think she
realized how big of a mess she would create. From Carlotta’s phone call with her friend
Mouse talking about her and Leo’s nonexistent sex life (Video 1 at 43 minutes and 05
seconds till Video 2 at 2 minutes and 29 seconds), all the way to Leo and Pepe switching
phones so Leo wouldn't get caught with his “companion”, as he calls her (Video 1 at 40
minutes and 11 seconds) , and Pepe having to announce to all his friends that he was gay.
(Video 3 in 2 minutes, 55 seconds). I think why almost every culture can relate to this movie
is because everyone has secrets that hide from friends, family, and loved ones. Pepe was
hiding a huge part of himself from his friends because of the fear that they wouldn't accept
him or even like him anymore, and for a moment he was right in feeling that way. All three
of his friends, Rocco, Leo, and Simon, used hurtful language, and really made Pepe feel
uncomfortable with whom he is as a gay person (Video 2 at 34 minutes and 18 seconds). I
am glad that, at the end, the three boys made it up to Pepe by beating up the man who has
been sending hateful messages to him and became friends again. I think in every culture
we need to be honest and communicate with our friends and loved ones to avoid chaos
and drama, and to support them and love them for who they are.",95.0,"
Hi Kealani, 

I appreciate that you took the time to watch the film twice and engage deeply with the characters the second time around. 

You mentioned that ""all three"" friends were hurtful to Pepe, but this misses the nuance of the scene: Simon was the aggressor with homophobic comments, while Rocco was actually quite supportive and tried to de-escalate the situation.

Finally, try to maintain a more formal academic tone in future assignments and double-check your grammar (see the attached suggestions). 

Overall, good work! ",High,q3_75th
