example_id,module,movie,essay_question,movie_details,student_essay,grade,teacher_feedback,grade_category,stratum
M3_002,3,Another Round,"Although, at first glance, the film Another Round seems to endorse drinking alcohol to improve one's life, pretty quickly, we realize that getting tipsy is not improving the characters' lives in the long run. In fact, as can be seen in the suicide/death of one of the characters, drinking can also enhance negative and depressive feelings. However, although drinking was not the solution, and the film does not have a traditional Hollywood-like happy end, the main character, Martin, did undergo a transformation.

If the instructor suspects a student used an AI text generator (e.g., ChatGPT), the instructor will require student to complete a similar assignment using Honorlock, an online proctoring service. The instructor may also require a student to complete all remaining assignments in a proctored environment.
Please cite a scene in the film that shows him being depressed or unmotivated and a scene that showcases his changed, happier and more inspired, attitude. Indicate, using a time stamp, where in the film this comes up (e.g., Video 2 at 12 min 30 seconds).
What, do you think, is the insight Martin gains that allows him to grow? What might be the final message of the movie as to one's attitude toward life and living? ","Another Round (Danish: Druk, lit. 'Binge drinking') is a 2020 black comedy-drama film directed by Thomas Vinterberg, co-written with Tobias Lindholm. Starring Mads Mikkelsen, Thomas Bo Larsen, Magnus Millang, and Lars Ranthe, the film follows four high school teachers who experiment with maintaining a constant level of alcohol in their blood to boost creativity and confidence.[1]

Premiering at the 2020 Toronto International Film Festival, the film won the Academy Award for Best International Feature Film and multiple other accolades. The film is dedicated to Vinterberg's daughter, Ida, who died during production.
Plot

Teachers Martin, Tommy, Peter, and Nikolaj are colleagues and friends who work at a gymnasium school in Copenhagen. All four struggle with unmotivated students and feel that their lives have become boring and stale. Martin is confronted by his senior students and their parents, who express that he has become a barrier to their passing their history exams. At a dinner celebrating Nikolaj's 40th birthday, the group discusses a theory inspired by the work of psychiatrist Finn Skårderud-that humans are born with a blood alcohol content (BAC) deficiency of 0.05% and that maintaining a BAC of 0.05% makes one more creative and relaxed.

The friends decide to embark on an experiment to test Skårderud's theory. They start a group log documenting their experiences as they drink at regular intervals to maintain this blood alcohol level. Two of them have personal struggles that make the experiment particularly appealing: Martin is depressed and alienated from his family and students, while Nikolaj's wife seems to have contempt for him. They agree on a set of rules: their BAC should never drop below 0.05 during the day on weekdays, and they should not drink after 8:00 p.m. or on weekends. Each man finds his own way to sneak alcohol during the day while teaching or coaching children, but they never drink and drive, with 0.05 being the legal limit.

Within a short period, all four find their work and private lives more enjoyable and successful. Martin, in particular, is delighted as he reconnects with his wife and children. His teaching becomes inspired, and his students begin enjoying class and respecting him. He even incorporates alcohol into his history lessons, engaging his heavy-drinking students. Encouraged by their success, the group decides to take the experiment further, increasing their BAC minimum to 0.10. Still feeling the benefits, they eventually push the boundaries further, deciding one night to drink to oblivion to test its liberating effects. However, after returning home incapacitated, both Martin and Nikolaj are confronted by their families. Martin's family expresses concern, revealing that they have known he has been drinking for weeks. He and his wife acknowledge their growing distance, and she admits to infidelity. The group abandons the experiment. Martin and his wife separate, and although he tries to make amends, she rejects him.

All members of the group stop drinking during the day, except for Tommy, whom the others try to support. However, at a faculty meeting where the headmaster reveals that teachers have been drinking at work, Tommy arrives visibly intoxicated. Later, he boards his boat while drunk, takes his old dog with him, motors out onto the bay, and ultimately goes overboard, drowning at sea.

After Tommy's funeral, the three remaining friends go out to dinner to celebrate his life, enjoying sparkling wine. While dining, Martin receives a text from his wife saying she misses him. As they sit by the harbour, recently graduated students pass by, celebrating in their customary drunken revelry. Martin, Peter, and Nikolaj join them in drinking and dancing. Martin, a former jazz ballet dancer, finally gives in to his colleagues' previous urgings and dances with the students. His movements grow increasingly energetic and joyous before he finishes his dance by spontaneously jumping into the sea. Four teacher friends start a social experiment in Thomas Vinterberg's smart and ultimately moving ""Another Round."" Based on a belief that the human body is born with too low an alcohol level, they strive to maintain a 0.05% BAC at all times-buzzed but far from drunk. They set rules. They can only drink during work hours (yes, as teachers). The idea is that a low-level buzz releases stress and tension in ways that nothing else can. To varying degrees, all four men are going through what could be called a midlife crisis, dissatisfied by the mundanity of daily life as teachers, but it's Martin (Mads Mikkelsen) who is in the deepest funk. He has lost all passion for teaching his history class, feels distant from his family, and can't find many reasons to get up. The social experiment breaks him out of his rut in a relatively predictable way, but Mikkelsen elevates what could have been another traditional message movie about living life to the fullest even after you think you've had your final drink.

Shortly after the experiment begins, Vinterberg stages a scene in Martin's classroom, where he's engaging with his students in a way he clearly hasn't in years. He's getting them involved with vibrant conversation and new ways to look at history. He's smiling in that very Mads way. What's brilliant about the scene is how Vinterberg and cinematographer Sturla Brandth Grøvlen replicate that slightly wobbly feeling that comes after just a strong drink or two. Martin is nowhere near blacking out or doing anything embarrassing, but the slightly unsteady camera swoops in for a close-up and then back out again in the inconsistent way that the world sometimes does after a couple glasses of wine-the filmmaking coming to life like how Martin is with his new buzz on life. It's indicative of the high craft on display here as the visual language subtly matches the character's journey.

Martin's colleagues (Thomas Bo Larsen, Magnus Millang, & Lars Ranthe-all effective) find similar success, at least at first. A music teacher encourages his students to sing more with their hearts and souls; a philosophy teacher catches onto the anxiety of one of his students in a way he may not have given his previously detached approach. Then the quartet starts to change the terms of the experiment, which everyone knows is a bad idea. If 0.05% works so well for Martin that he feels better even when he's sober, maybe he should go higher? They start pushing the envelope. Absinthe gets involved. As anyone who has tried it can tell you, Absinthe is almost always a bad idea. Trust me.  

""Another Round"" reaches beyond its set-up when it becomes a study in individuality. The experiment affects each of the four men differently, and everyone knows that a drunk night comes with a hungover morning. A student near the end gives an exam on the Kierkegaardian philosophies on anxiety and accepting fallibility and failure, which is what all midlife crisis films are about to a certain degree-coming to terms with mistakes after you realize you may be running out of time to correct them.  

The midsection of ""Another Round,"" wherein the guys open up and alter their experiment based on results, has a tendency to drag, but Vinterberg avoids cliché in this bulk of the film, thanks largely to casting his favorite leading man (Mikkelsen starred in the director's excellent ""The Hunt""). The ""Hannibal"" star is such a genuinely captivating actor-one of those performers who holds the camera like a movie star while also feeling completely realistic and in the moment at the same time. He doesn't hit a single false note in a film that really could have been all broad humor and wacky hijinks. Even as the final act starts to get a bit manipulative by stretching some previously established realism, Mikkelsen holds it together, and then he comes out literally swinging in one of the best final scenes of the year. It's such a jubilant moment that you may walk out of the theater feeling a little buzzed. ","The film ”Another Round” has many twists in the outcomes of alcohol endorsement.
Even though keeping a BAC of 0.05% was supposed to make everyone feel more relaxed in the
experiment, it soon became something that grew out of control, leading to many damaged
relationships, and ruined reputations. In the film, Martin seems depressed and sad, trying to
reconstruct his marriage (Another Round, video 4, 1:27). He realized the outcomes of
participating in the experiment, and the effects of going overboard with drinking. In this scene,
he is telling his ex wife he misses her and is trying to apologize for his behavior. He seems to be
holding a lot of regret in his actions, stating that he wishes he was back together with his wife.
Shortly after, Anika leaves the table saying she can no longer love him or be with him. On the
other hand, Martin seems happy in the scene where he is canoeing with his family (Another
Round, video 3, 1:02). They are trying to race down to the land in front of them, laughter is
shared, and Martin seems truly happy around his family for the first time in the movie. After this
clip the film displays “0.0%” showing that he did not have any drinks before this activity. I believe
this shows the true meaning of the film. While Martin's drinking was the reason this trip was
even planned, he is truly happy to spend time with his family doing an activity they used to do
together many years ago. However, after this he gets very drunk with his friends doing the
experiment, and this ends up very poorly. As a result, he has to explain his actions to his kids
and wife. Anika brings up her concerns on how she has felt invisible to Martin for years. This
shows that Martin gained the insight of being able to have fun with his family without alcohol. It
also shows him the damage drinking can do to his relationships. The final message of this film is
that temporary placeholders, such as drugs or drinking, will never solve problems but make
them much worse. This is why there was a temporary relief for Martin when he started drinking
and teaching right after, but the overall result ended up with him losing his wife and being a bad
example for his children.",95.0,"
Hi Diana, 

You selected two strong scenes to contrast Marin's emotional state. 

While you have a good understanding of specific scenes, the essay reads a bit confusingly due to its organization. Currently, you present the restaurant scene (Video 4, 1:27), which occurs after the canoeing trip and the incident where Martin passes out on the street, before introducing the canoeing trip itself (Video 3). The essay would flow much more smoothly if you explained these scenes in the order they appear in the film, especially when you make the connection between these scenes. 

Additionally, for your next assignment, please pay attention to your use of punctuation (e.g., commas) and ensure you use the appropriate verb forms. 

Overall, good work! ",High,q3_75th
M3_003,3,Another Round,"Although, at first glance, the film Another Round seems to endorse drinking alcohol to improve one's life, pretty quickly, we realize that getting tipsy is not improving the characters' lives in the long run. In fact, as can be seen in the suicide/death of one of the characters, drinking can also enhance negative and depressive feelings. However, although drinking was not the solution, and the film does not have a traditional Hollywood-like happy end, the main character, Martin, did undergo a transformation.

If the instructor suspects a student used an AI text generator (e.g., ChatGPT), the instructor will require student to complete a similar assignment using Honorlock, an online proctoring service. The instructor may also require a student to complete all remaining assignments in a proctored environment.
Please cite a scene in the film that shows him being depressed or unmotivated and a scene that showcases his changed, happier and more inspired, attitude. Indicate, using a time stamp, where in the film this comes up (e.g., Video 2 at 12 min 30 seconds).
What, do you think, is the insight Martin gains that allows him to grow? What might be the final message of the movie as to one's attitude toward life and living? ","Another Round (Danish: Druk, lit. 'Binge drinking') is a 2020 black comedy-drama film directed by Thomas Vinterberg, co-written with Tobias Lindholm. Starring Mads Mikkelsen, Thomas Bo Larsen, Magnus Millang, and Lars Ranthe, the film follows four high school teachers who experiment with maintaining a constant level of alcohol in their blood to boost creativity and confidence.[1]

Premiering at the 2020 Toronto International Film Festival, the film won the Academy Award for Best International Feature Film and multiple other accolades. The film is dedicated to Vinterberg's daughter, Ida, who died during production.
Plot

Teachers Martin, Tommy, Peter, and Nikolaj are colleagues and friends who work at a gymnasium school in Copenhagen. All four struggle with unmotivated students and feel that their lives have become boring and stale. Martin is confronted by his senior students and their parents, who express that he has become a barrier to their passing their history exams. At a dinner celebrating Nikolaj's 40th birthday, the group discusses a theory inspired by the work of psychiatrist Finn Skårderud-that humans are born with a blood alcohol content (BAC) deficiency of 0.05% and that maintaining a BAC of 0.05% makes one more creative and relaxed.

The friends decide to embark on an experiment to test Skårderud's theory. They start a group log documenting their experiences as they drink at regular intervals to maintain this blood alcohol level. Two of them have personal struggles that make the experiment particularly appealing: Martin is depressed and alienated from his family and students, while Nikolaj's wife seems to have contempt for him. They agree on a set of rules: their BAC should never drop below 0.05 during the day on weekdays, and they should not drink after 8:00 p.m. or on weekends. Each man finds his own way to sneak alcohol during the day while teaching or coaching children, but they never drink and drive, with 0.05 being the legal limit.

Within a short period, all four find their work and private lives more enjoyable and successful. Martin, in particular, is delighted as he reconnects with his wife and children. His teaching becomes inspired, and his students begin enjoying class and respecting him. He even incorporates alcohol into his history lessons, engaging his heavy-drinking students. Encouraged by their success, the group decides to take the experiment further, increasing their BAC minimum to 0.10. Still feeling the benefits, they eventually push the boundaries further, deciding one night to drink to oblivion to test its liberating effects. However, after returning home incapacitated, both Martin and Nikolaj are confronted by their families. Martin's family expresses concern, revealing that they have known he has been drinking for weeks. He and his wife acknowledge their growing distance, and she admits to infidelity. The group abandons the experiment. Martin and his wife separate, and although he tries to make amends, she rejects him.

All members of the group stop drinking during the day, except for Tommy, whom the others try to support. However, at a faculty meeting where the headmaster reveals that teachers have been drinking at work, Tommy arrives visibly intoxicated. Later, he boards his boat while drunk, takes his old dog with him, motors out onto the bay, and ultimately goes overboard, drowning at sea.

After Tommy's funeral, the three remaining friends go out to dinner to celebrate his life, enjoying sparkling wine. While dining, Martin receives a text from his wife saying she misses him. As they sit by the harbour, recently graduated students pass by, celebrating in their customary drunken revelry. Martin, Peter, and Nikolaj join them in drinking and dancing. Martin, a former jazz ballet dancer, finally gives in to his colleagues' previous urgings and dances with the students. His movements grow increasingly energetic and joyous before he finishes his dance by spontaneously jumping into the sea. Four teacher friends start a social experiment in Thomas Vinterberg's smart and ultimately moving ""Another Round."" Based on a belief that the human body is born with too low an alcohol level, they strive to maintain a 0.05% BAC at all times-buzzed but far from drunk. They set rules. They can only drink during work hours (yes, as teachers). The idea is that a low-level buzz releases stress and tension in ways that nothing else can. To varying degrees, all four men are going through what could be called a midlife crisis, dissatisfied by the mundanity of daily life as teachers, but it's Martin (Mads Mikkelsen) who is in the deepest funk. He has lost all passion for teaching his history class, feels distant from his family, and can't find many reasons to get up. The social experiment breaks him out of his rut in a relatively predictable way, but Mikkelsen elevates what could have been another traditional message movie about living life to the fullest even after you think you've had your final drink.

Shortly after the experiment begins, Vinterberg stages a scene in Martin's classroom, where he's engaging with his students in a way he clearly hasn't in years. He's getting them involved with vibrant conversation and new ways to look at history. He's smiling in that very Mads way. What's brilliant about the scene is how Vinterberg and cinematographer Sturla Brandth Grøvlen replicate that slightly wobbly feeling that comes after just a strong drink or two. Martin is nowhere near blacking out or doing anything embarrassing, but the slightly unsteady camera swoops in for a close-up and then back out again in the inconsistent way that the world sometimes does after a couple glasses of wine-the filmmaking coming to life like how Martin is with his new buzz on life. It's indicative of the high craft on display here as the visual language subtly matches the character's journey.

Martin's colleagues (Thomas Bo Larsen, Magnus Millang, & Lars Ranthe-all effective) find similar success, at least at first. A music teacher encourages his students to sing more with their hearts and souls; a philosophy teacher catches onto the anxiety of one of his students in a way he may not have given his previously detached approach. Then the quartet starts to change the terms of the experiment, which everyone knows is a bad idea. If 0.05% works so well for Martin that he feels better even when he's sober, maybe he should go higher? They start pushing the envelope. Absinthe gets involved. As anyone who has tried it can tell you, Absinthe is almost always a bad idea. Trust me.  

""Another Round"" reaches beyond its set-up when it becomes a study in individuality. The experiment affects each of the four men differently, and everyone knows that a drunk night comes with a hungover morning. A student near the end gives an exam on the Kierkegaardian philosophies on anxiety and accepting fallibility and failure, which is what all midlife crisis films are about to a certain degree-coming to terms with mistakes after you realize you may be running out of time to correct them.  

The midsection of ""Another Round,"" wherein the guys open up and alter their experiment based on results, has a tendency to drag, but Vinterberg avoids cliché in this bulk of the film, thanks largely to casting his favorite leading man (Mikkelsen starred in the director's excellent ""The Hunt""). The ""Hannibal"" star is such a genuinely captivating actor-one of those performers who holds the camera like a movie star while also feeling completely realistic and in the moment at the same time. He doesn't hit a single false note in a film that really could have been all broad humor and wacky hijinks. Even as the final act starts to get a bit manipulative by stretching some previously established realism, Mikkelsen holds it together, and then he comes out literally swinging in one of the best final scenes of the year. It's such a jubilant moment that you may walk out of the theater feeling a little buzzed. ","I loved Around the World; I was very intrigued the entire movie about how these four
men believed that drinking alcohol every day was beneficial for them and made their lives
better. At first it seemed that this was the case for Martin. Martin right away at the
beginning of the film already showed how unhappy and unmotivated he was with his life at
home and his professional career. The students in his class showed very little respect for
Martin because martin didn't have any respect for himself. He even asked his wife, Anika, if
he was boring now compared to his younger self, at which point she didn't hesitate to say
that he isn't the same Martin she met all those years ago (video 1 at 6 minutes 56
seconds.). At the birthday dinner for one of his four friends/collogues, they even expressed
how they thought he was boring for not drinking at dinner (video 1 at 12 minutes 35
seconds), and told him that he lacks self-confidence and happiness in the classroom and
that is why his students misbehave (video 1 at 15 minutes 46 seconds). He confides in his
friends that he never sees many people and that he and his wife haven't been the same in
so long before. So after the discussion about Finn Skarderud and his claim that you need to
maintain a 0.05% BAC to be more relaxed, poised, musical, and opened, Martin couldnt
resist the temptation and immediately chugged a glass of wine at dinner to the point where
they stay out super late and have a great night (video 1 at 22 minutes 53 seconds). You
start to see that his confidence really does grow and he is more brave to be himself and
actually get the students involved, you immediately can see that the students are far more
interested in class when Martin actually cares and is interested in what he is teaching
(video 2 at 2 minutes 25 seconds). But not only did his confidence improve, it did at home
as well, he took his family on their canoe and camping trip that they used to go on years
ago and even had an intimate moment with his wife (video 3 at 1 minute 20 seconds).
However, the rush couldn't las forever, eventually everything came crashing down when all
four men couldn't go a day without depending on alcohol to get through the day and even
lost their friend Tommy (video 4 at 10 minutes 55 seconds). Through everything though, I
think martin started to realize that alcohol is making his life worse, he saw what it did to his
friend tommy and really took a step back and looked in the mirror. I also think that he
realized he didn't need to drink to be passionate about what he does for a living. The
students passing those exams really showed him that if he just put in some effort and
attention, his students would pass, and it goes to show that just having confidence in
yourself can make the world of a difference and how you see yourself, present yourself, but
also be there for others as well.",85.0,"Hi Kealani, 

You did a great job tracking Martin's journey from feeling ""boring"" to the joy of the canoe trip. 

However, you need improvement in the following areas: 

Length: It is too long. The required word range is between 300 and 400 words. Next time, focus on analyzing the scenes rather than retelling them. 
Content analysis: You argued that Martin learned he doesn't need alcohol, but he is clearly drinking in the final moments of the movie. Addressing this is key to understanding the film's complex message. 
Accuracy: You referred to the film as ""Around the World."" 
Typos/Grammar: Please proofread before submission. I left comments directly on your submission. ",High,median_high
