example_id,module,movie,essay_question,movie_details,student_essay,grade,teacher_feedback,grade_category,stratum
M2_003,2,Perfect Secret,"The Perfect Secret is a German adaptation of an Italian film called Perfetti Sconosciuti. The Italian original has made history by being adapted into at least 18 different languages besides German (https://www.imdb.com/list/ls082389916/Links to an external site.), such as Arabic, French, Korean, Greek, Turkish, Chinese, etc. Why does the topic/theme seem to have such universal applicability, i.e. fit into so many different cultural contexts? Please cite a scene and situation in the film that you think is particularly true-for-all relationships, either romantic relationships or friendships. Indicate, using a time stamp, where in the film this comes up (e.g., Video 2 at 12 min 30 seconds).","The perfect secret is a 2019 German film comedy by director and screenwriter Bora Dagtekin.

The ensemble film is a remake of the Italian cinema film Perfetti Sconosciuti (about ""completely unknown"") by Paolo Genovese from 2016, which has already been remade in numerous countries. It is about seven friends who, at a dinner together, put their trust to the test by agreeing to share all the messages and calls received on their mobile phones during the meal with those present.

KammerspielThe tragicomic chamber play was produced by Constantin Film Production. In addition to Lena Schömann, Dagtekin also appeared as a producer. The filming took place between January and March 2019 in Munich and Geretsried. Karoline Herfurth, Elyas M'Barek, Florian David Fitz, Jella Haase, Frederick Lau, Jessica Schwarz and Wotan Wilke Möhring were committed to the cast. The German-wide release in the cinema took place on 31. October 2019. Among critics, the perfect secret came across a mixed echo.
Action

The couple Eva and Rocco invite their friends to dinner in their Munich attic apartment. Even before the guests arrive, there is a dispute between therapist Eva and her teenage daughter Sophie, after Eva found condoms in their pocket and confronted them. Sophie, who is on her way to her boyfriend Mike and has an increasingly tense relationship with her controlled mother, sees herself patronized again by Eva. Father Rocco, who can mediate between the two, meanwhile, employs something completely different: While the hobby chef is approached with the preparation of the food, he receives revealing selfies of an acquaintance on his mobile phone. Eva, who has been quietly observing her husband for a long time, is suspicious, but does not know about it.

First, the couple arrives Carlotta and Leo. Leo, who has put his career as a construction draftsman in favor of his wife, who has been working in an advertising agency again since the birth of the twins, is struggling with his fate as a house husband and full-time father. Carlotta, on the other hand, feels pushed into the second row: The copywriter, who usually works late into the evening and is rarely at home, has a distanced relationship with her children. The two will be accompanied by Bianca and Simon. Unlike Carlotta and Leo, the animal health practitioner and the life artist are freshly in love and strive for a trusting relationship with each other. However, Bianca, the youngest in the league, has only recently met Simon's longtime friends and occasionally feels ridiculed by the others.

After the high school teacher Pepe has arrived without his also expected and supposedly sick friend Anna and has placed his brought telescope to the sighting of the lunar eclipse announced for the night on the balcony, the group takes a seat in the dining room. At Rocco's inedible food and abundant wine, they begin to discuss the issue of honesty exuberantly. Without further ado, they want to put their mutual trust to the test and engage in a game conceived by Eva: Everyone must share all activities that run via their smartphone with those present. While Carlotta and Bianca immediately show themselves enthusiastic about the idea, the men only hesitantly agree with the project.

What should initially become a harmless game among friends quickly causes a glare: Leo, who has an affair with a playground acquaintance, expects a revealing photo of this and asks Pepe to exchange the mobile phones with him to cover up the matter. However, when Leo has to go to Pepe's phone in return, Pepe's contact reports to Hannes, whose ambiguities suggest to the others that he is sleeping with Leo. While Leo's supposed bisexuality, which he does not deny for fear of becoming aware of his actual affair with his friends, encounters incomprehension, Carlotta falls out of all the clouds and gets drunk. When she receives a clear voicemail from her colleague, she is forced to admit a drug problem triggered by the career pressure in her friends.

Pepe dissolves the farce when he confesses to the exchange action and reveals to the others his homosexuality, which has been concealed for many years, for which he is discriminated against by a father at his school and had expected incomprehension from his friends. Simon, meanwhile, receives a call from his colleague, who tells him to be pregnant by him. Bianca is deeply struck by the news and breaks with him immediately. Eva, who is secretly also having an affair with Simon, slaps him in the absence of the others and does the same. The guests then leave the apartment separately. Eva and Rocco, who are left alone, are looking for the conversation on the balcony and reconciling each other - but without telling the other about their own affair.

Some time after dinner, Leo and Carlotta have also found each other again and also opted for a role exchange: While he is pursuing a job offer, Carlotta now takes care of the two children full-time. In order to prove their friendship to the insulted Pepe, Rocco, Leo and Simon, meanwhile, beat up the father of Pepe's student, who then steers in and settles the conflict he provokes. The four childhood friends reconcile and travel together. When a ringing sounds along the way, Rocco draws an old-fashioned two-phone and confirms the other his affair. While Pepe, Leo and Simon try to snatch the device from him, Rocco throws the mobile phone into the Isar. ","This film covers a range of topics and themes such as homophobia, infidelity, and
the nature of friendship, and due to these topics it is adapted in more than 18 languages
across different cultures. The film shows how a group of friends sit at a dinner table and
explore their hidden secret. It shows how little the friends and romantic partners know
each other and how all their secrets are hidden in their phones. The film is able to be
adapted into multiple cultures because of its simplicity. The film was able to cover a
series of topics simply in the setting of friends at a dinner table playing a game. At the
core of the story is the idea that our smartphones hold our most private thoughts,
conversations, and secrets. Since smartphones are now an essential part of daily life
across the world, the fear of having one's digital life exposed is something audiences
from many cultural backgrounds can immediately relate to.
The topic also resonates universally because infidelity, trust, and secrecy are
fundamental issues in both romantic relationships and friendships. While different
cultures may have different cultural norms regarding privacy or relationships, nearly all
people understand the tension between wanting to be fully known and wanting to
protect a certain part of themselves. The dinner-table setting reinforces this universality
as sharing a meal with close friends, showing how intimate and realistic the situation is,
allowing the story to be easily adapted to different cultural contexts without losing its
impact.
There are multiple scenes that can be true for all relationships. For instance, at 42
minutes and 17 seconds, Carlotta gets a call from her childhood where she begins to
give advice on how to improve Carlotta's sex life with Leo. As a woman, this is relatively
relatable as I tell my girlfriends everything. In almost every friendship I've had with
another woman it is normal to open up about everything including more private things.
So, I believe this scene wonderfully demonstrates female friendships. Even after
Carlotta ends the conversation with her friend she doesn’t really show shame but rather
says “yes, surprise I talk to my best friend about our sex life” demonstrating the lack of
judgment and the deep trust that can exist in close friendships. This moment also shows
how different female relationships are in comparison to male friendships considering
Leo was very shocked by how comfortable she was to talk to her best friend about
private matters.
Another scene is at 29 minutes and 10 seconds of the second clip. Leo and Pepe
switched phones so Carlotta wouldn’t find out about Leo’s affair. However that soon
backfires because Pepe was hiding a secret about being homosexual. The scene erupts
into a huge misunderstanding where Carlotta believes her husband, Leo is gay.
However despite Pepe and Leo both knowing the truth of the situation, Leo refuses to
expose Pepe. This shows how deep the trust goes within their friendship. Leo’s
marriage was on the verge of collapsing but he refused to admit the truth only to defend
and protect his close friend. I believe it's fair to say that this scene can be shown across
all friendships, because in all friendships trust runs deep and it demonstrates how
friends have each other's backs no matter the situation.
Overall, the film “Perfect Secret” shows that simple settings can explore universal truths
about relationships. Through the dinner-table game and the revelations in scenes with
Carlotta and Leo, the film highlights trust, secrecy, and loyalty in both friendships and
romantic partnerships. These experiences are relatable across cultures, which is why
the story has been adapted into so many languages. The film demonstrates that,
despite cultural differences, the complexities of human relationships are truly universal.",86.0,"
Hi Kseniya, great job analyzing the film's gender dynamics. Your point about Carlotta was excellent: the universality here is that female friendships often involve a level of disclosure that men find shocking. 

However, you need to be much more concise. You exceeded the maximum word count by a wide margin. You have two introductory paragraphs that say essentially the same thing. You could combine these into one. 

Additionally, please proofread for phrasing and punctuation. In terms of phrasing, for example, you wrote ""Carlotta gets a call from her childhood...."" You likely meant ""from her childhood friend."" For punctuation, watch your commas. ""However that soon backfires..."" needs a comma after ""However."" ",High,median_high
M2_004,2,Perfect Secret,"The Perfect Secret is a German adaptation of an Italian film called Perfetti Sconosciuti. The Italian original has made history by being adapted into at least 18 different languages besides German (https://www.imdb.com/list/ls082389916/Links to an external site.), such as Arabic, French, Korean, Greek, Turkish, Chinese, etc. Why does the topic/theme seem to have such universal applicability, i.e. fit into so many different cultural contexts? Please cite a scene and situation in the film that you think is particularly true-for-all relationships, either romantic relationships or friendships. Indicate, using a time stamp, where in the film this comes up (e.g., Video 2 at 12 min 30 seconds).","The perfect secret is a 2019 German film comedy by director and screenwriter Bora Dagtekin.

The ensemble film is a remake of the Italian cinema film Perfetti Sconosciuti (about ""completely unknown"") by Paolo Genovese from 2016, which has already been remade in numerous countries. It is about seven friends who, at a dinner together, put their trust to the test by agreeing to share all the messages and calls received on their mobile phones during the meal with those present.

KammerspielThe tragicomic chamber play was produced by Constantin Film Production. In addition to Lena Schömann, Dagtekin also appeared as a producer. The filming took place between January and March 2019 in Munich and Geretsried. Karoline Herfurth, Elyas M'Barek, Florian David Fitz, Jella Haase, Frederick Lau, Jessica Schwarz and Wotan Wilke Möhring were committed to the cast. The German-wide release in the cinema took place on 31. October 2019. Among critics, the perfect secret came across a mixed echo.
Action

The couple Eva and Rocco invite their friends to dinner in their Munich attic apartment. Even before the guests arrive, there is a dispute between therapist Eva and her teenage daughter Sophie, after Eva found condoms in their pocket and confronted them. Sophie, who is on her way to her boyfriend Mike and has an increasingly tense relationship with her controlled mother, sees herself patronized again by Eva. Father Rocco, who can mediate between the two, meanwhile, employs something completely different: While the hobby chef is approached with the preparation of the food, he receives revealing selfies of an acquaintance on his mobile phone. Eva, who has been quietly observing her husband for a long time, is suspicious, but does not know about it.

First, the couple arrives Carlotta and Leo. Leo, who has put his career as a construction draftsman in favor of his wife, who has been working in an advertising agency again since the birth of the twins, is struggling with his fate as a house husband and full-time father. Carlotta, on the other hand, feels pushed into the second row: The copywriter, who usually works late into the evening and is rarely at home, has a distanced relationship with her children. The two will be accompanied by Bianca and Simon. Unlike Carlotta and Leo, the animal health practitioner and the life artist are freshly in love and strive for a trusting relationship with each other. However, Bianca, the youngest in the league, has only recently met Simon's longtime friends and occasionally feels ridiculed by the others.

After the high school teacher Pepe has arrived without his also expected and supposedly sick friend Anna and has placed his brought telescope to the sighting of the lunar eclipse announced for the night on the balcony, the group takes a seat in the dining room. At Rocco's inedible food and abundant wine, they begin to discuss the issue of honesty exuberantly. Without further ado, they want to put their mutual trust to the test and engage in a game conceived by Eva: Everyone must share all activities that run via their smartphone with those present. While Carlotta and Bianca immediately show themselves enthusiastic about the idea, the men only hesitantly agree with the project.

What should initially become a harmless game among friends quickly causes a glare: Leo, who has an affair with a playground acquaintance, expects a revealing photo of this and asks Pepe to exchange the mobile phones with him to cover up the matter. However, when Leo has to go to Pepe's phone in return, Pepe's contact reports to Hannes, whose ambiguities suggest to the others that he is sleeping with Leo. While Leo's supposed bisexuality, which he does not deny for fear of becoming aware of his actual affair with his friends, encounters incomprehension, Carlotta falls out of all the clouds and gets drunk. When she receives a clear voicemail from her colleague, she is forced to admit a drug problem triggered by the career pressure in her friends.

Pepe dissolves the farce when he confesses to the exchange action and reveals to the others his homosexuality, which has been concealed for many years, for which he is discriminated against by a father at his school and had expected incomprehension from his friends. Simon, meanwhile, receives a call from his colleague, who tells him to be pregnant by him. Bianca is deeply struck by the news and breaks with him immediately. Eva, who is secretly also having an affair with Simon, slaps him in the absence of the others and does the same. The guests then leave the apartment separately. Eva and Rocco, who are left alone, are looking for the conversation on the balcony and reconciling each other - but without telling the other about their own affair.

Some time after dinner, Leo and Carlotta have also found each other again and also opted for a role exchange: While he is pursuing a job offer, Carlotta now takes care of the two children full-time. In order to prove their friendship to the insulted Pepe, Rocco, Leo and Simon, meanwhile, beat up the father of Pepe's student, who then steers in and settles the conflict he provokes. The four childhood friends reconcile and travel together. When a ringing sounds along the way, Rocco draws an old-fashioned two-phone and confirms the other his affair. While Pepe, Leo and Simon try to snatch the device from him, Rocco throws the mobile phone into the Isar. ","The German movie The Perfect Secret shows a theme that seems to work in almost any culture, how honesty, trust, and privacy affect relationships. The movies main idea is that a group of friends decides to share all the messages on their phones during a dinner. This situation creates a lot of tension, surprises, and funny moments. I think this story can be told in so many different countries because almost everyone has a phone and uses it to talk to friends, family, or romantic partners. Everyone also has secrets or things they keep private, so the story feels familiar no matter where you live.

One scene that really shows this is around 12 minutes and 30 seconds into the movie, when the game starts and Bianca realizes how much personal information everyone can see. The friends all react with awkward laughter, shock, and a little panic. This scene shows how hard it is to balance honesty and privacy in relationships. It’s something everyone can relate to because we all have moments when we don’t want others to know everything about us, even our closest friends or partners. Another part that feels universal is when Pepe helps his student talk to a girl on social media. It shows that people often try to help each other but might do it in ways that reveal secrets or private things. These moments are both funny and real because they show how complicated relationships can be, even with good intentions.

Overall, I think The Perfect Secret works in so many cultures because it talks about things that are true for everyone trust, curiosity, and dealing with secrets. The story uses a smartphone, which everyone knows, but it’s really about how people interact, what they hide, and how they deal with each other. That’s why the movie has been adapted into so many languages and still makes sense everywhere.",84.0,"Hi Ciara,

You correctly identified the film's central themes of trust and privacy.

However, you claimed that the game starts around 12:30, but at that point in the film, the characters are simply having a conversation about Pepe's new partner; the game has not begun.

Additionally, phrases like ""awkward laughter, shock, and a little panic"" and ""funny moments"" are a bit general. To improve, you need to analyze why the character behaves as they do. Lastly, be careful with punctuation errors and possessive apostrophes.

Overall, good work! ",Low,q1_25th
