example_id,module,movie,essay_question,movie_details,student_essay,grade,teacher_feedback,grade_category,stratum
M2_005,2,Perfect Secret,"The Perfect Secret is a German adaptation of an Italian film called Perfetti Sconosciuti. The Italian original has made history by being adapted into at least 18 different languages besides German (https://www.imdb.com/list/ls082389916/Links to an external site.), such as Arabic, French, Korean, Greek, Turkish, Chinese, etc. Why does the topic/theme seem to have such universal applicability, i.e. fit into so many different cultural contexts? Please cite a scene and situation in the film that you think is particularly true-for-all relationships, either romantic relationships or friendships. Indicate, using a time stamp, where in the film this comes up (e.g., Video 2 at 12 min 30 seconds).","The perfect secret is a 2019 German film comedy by director and screenwriter Bora Dagtekin.

The ensemble film is a remake of the Italian cinema film Perfetti Sconosciuti (about ""completely unknown"") by Paolo Genovese from 2016, which has already been remade in numerous countries. It is about seven friends who, at a dinner together, put their trust to the test by agreeing to share all the messages and calls received on their mobile phones during the meal with those present.

KammerspielThe tragicomic chamber play was produced by Constantin Film Production. In addition to Lena Schömann, Dagtekin also appeared as a producer. The filming took place between January and March 2019 in Munich and Geretsried. Karoline Herfurth, Elyas M'Barek, Florian David Fitz, Jella Haase, Frederick Lau, Jessica Schwarz and Wotan Wilke Möhring were committed to the cast. The German-wide release in the cinema took place on 31. October 2019. Among critics, the perfect secret came across a mixed echo.
Action

The couple Eva and Rocco invite their friends to dinner in their Munich attic apartment. Even before the guests arrive, there is a dispute between therapist Eva and her teenage daughter Sophie, after Eva found condoms in their pocket and confronted them. Sophie, who is on her way to her boyfriend Mike and has an increasingly tense relationship with her controlled mother, sees herself patronized again by Eva. Father Rocco, who can mediate between the two, meanwhile, employs something completely different: While the hobby chef is approached with the preparation of the food, he receives revealing selfies of an acquaintance on his mobile phone. Eva, who has been quietly observing her husband for a long time, is suspicious, but does not know about it.

First, the couple arrives Carlotta and Leo. Leo, who has put his career as a construction draftsman in favor of his wife, who has been working in an advertising agency again since the birth of the twins, is struggling with his fate as a house husband and full-time father. Carlotta, on the other hand, feels pushed into the second row: The copywriter, who usually works late into the evening and is rarely at home, has a distanced relationship with her children. The two will be accompanied by Bianca and Simon. Unlike Carlotta and Leo, the animal health practitioner and the life artist are freshly in love and strive for a trusting relationship with each other. However, Bianca, the youngest in the league, has only recently met Simon's longtime friends and occasionally feels ridiculed by the others.

After the high school teacher Pepe has arrived without his also expected and supposedly sick friend Anna and has placed his brought telescope to the sighting of the lunar eclipse announced for the night on the balcony, the group takes a seat in the dining room. At Rocco's inedible food and abundant wine, they begin to discuss the issue of honesty exuberantly. Without further ado, they want to put their mutual trust to the test and engage in a game conceived by Eva: Everyone must share all activities that run via their smartphone with those present. While Carlotta and Bianca immediately show themselves enthusiastic about the idea, the men only hesitantly agree with the project.

What should initially become a harmless game among friends quickly causes a glare: Leo, who has an affair with a playground acquaintance, expects a revealing photo of this and asks Pepe to exchange the mobile phones with him to cover up the matter. However, when Leo has to go to Pepe's phone in return, Pepe's contact reports to Hannes, whose ambiguities suggest to the others that he is sleeping with Leo. While Leo's supposed bisexuality, which he does not deny for fear of becoming aware of his actual affair with his friends, encounters incomprehension, Carlotta falls out of all the clouds and gets drunk. When she receives a clear voicemail from her colleague, she is forced to admit a drug problem triggered by the career pressure in her friends.

Pepe dissolves the farce when he confesses to the exchange action and reveals to the others his homosexuality, which has been concealed for many years, for which he is discriminated against by a father at his school and had expected incomprehension from his friends. Simon, meanwhile, receives a call from his colleague, who tells him to be pregnant by him. Bianca is deeply struck by the news and breaks with him immediately. Eva, who is secretly also having an affair with Simon, slaps him in the absence of the others and does the same. The guests then leave the apartment separately. Eva and Rocco, who are left alone, are looking for the conversation on the balcony and reconciling each other - but without telling the other about their own affair.

Some time after dinner, Leo and Carlotta have also found each other again and also opted for a role exchange: While he is pursuing a job offer, Carlotta now takes care of the two children full-time. In order to prove their friendship to the insulted Pepe, Rocco, Leo and Simon, meanwhile, beat up the father of Pepe's student, who then steers in and settles the conflict he provokes. The four childhood friends reconcile and travel together. When a ringing sounds along the way, Rocco draws an old-fashioned two-phone and confirms the other his affair. While Pepe, Leo and Simon try to snatch the device from him, Rocco throws the mobile phone into the Isar. ","I believe that the movie is trying to convey that everyone has issues with communication and secrecy in relationships. This theme has universal applicability because it reflects the truth that people aren’t completely honest in relationships. We might do it because we want to preserve the relationship and are worried that the truth might harm it.

This idea is particularly evident in how Pepe comes out in Video 3 starting at 3 minutes and 0 seconds. Pepe first calls out the casual homophobia that his friends do. This highlights one element of why Pepe did not come out to them. He felt that his friends might not accept him and that the Peretti Gang might disband, which is a group that represents a reprieve from the harassment from his workplace.

Only at the end, when other people shared their secrets, did he share his. This highlights how once communication becomes more common does other people feel more confident in sharing. Even if the communication was forced like it was in the phone game at the dinner.",70.0,"
Hi Joshua, 

You identified a strong central theme regarding why we hide the truth. Your analysis of Pepe's motivation is excellent.

However, this essay does not meet the basic requirements of this assignment. At 176 words, it is far too short to count as a complete analysis. You need to elaborate on your points significantly to reach the 300-word minimum. Also, before submission, please review your grammar, specifically the sentence ""does other people feel,"" which is confusing.",Low,q1_25th
M3_001,3,Another Round,"Although, at first glance, the film Another Round seems to endorse drinking alcohol to improve one's life, pretty quickly, we realize that getting tipsy is not improving the characters' lives in the long run. In fact, as can be seen in the suicide/death of one of the characters, drinking can also enhance negative and depressive feelings. However, although drinking was not the solution, and the film does not have a traditional Hollywood-like happy end, the main character, Martin, did undergo a transformation.

If the instructor suspects a student used an AI text generator (e.g., ChatGPT), the instructor will require student to complete a similar assignment using Honorlock, an online proctoring service. The instructor may also require a student to complete all remaining assignments in a proctored environment.
Please cite a scene in the film that shows him being depressed or unmotivated and a scene that showcases his changed, happier and more inspired, attitude. Indicate, using a time stamp, where in the film this comes up (e.g., Video 2 at 12 min 30 seconds).
What, do you think, is the insight Martin gains that allows him to grow? What might be the final message of the movie as to one's attitude toward life and living? ","Another Round (Danish: Druk, lit. 'Binge drinking') is a 2020 black comedy-drama film directed by Thomas Vinterberg, co-written with Tobias Lindholm. Starring Mads Mikkelsen, Thomas Bo Larsen, Magnus Millang, and Lars Ranthe, the film follows four high school teachers who experiment with maintaining a constant level of alcohol in their blood to boost creativity and confidence.[1]

Premiering at the 2020 Toronto International Film Festival, the film won the Academy Award for Best International Feature Film and multiple other accolades. The film is dedicated to Vinterberg's daughter, Ida, who died during production.
Plot

Teachers Martin, Tommy, Peter, and Nikolaj are colleagues and friends who work at a gymnasium school in Copenhagen. All four struggle with unmotivated students and feel that their lives have become boring and stale. Martin is confronted by his senior students and their parents, who express that he has become a barrier to their passing their history exams. At a dinner celebrating Nikolaj's 40th birthday, the group discusses a theory inspired by the work of psychiatrist Finn Skårderud-that humans are born with a blood alcohol content (BAC) deficiency of 0.05% and that maintaining a BAC of 0.05% makes one more creative and relaxed.

The friends decide to embark on an experiment to test Skårderud's theory. They start a group log documenting their experiences as they drink at regular intervals to maintain this blood alcohol level. Two of them have personal struggles that make the experiment particularly appealing: Martin is depressed and alienated from his family and students, while Nikolaj's wife seems to have contempt for him. They agree on a set of rules: their BAC should never drop below 0.05 during the day on weekdays, and they should not drink after 8:00 p.m. or on weekends. Each man finds his own way to sneak alcohol during the day while teaching or coaching children, but they never drink and drive, with 0.05 being the legal limit.

Within a short period, all four find their work and private lives more enjoyable and successful. Martin, in particular, is delighted as he reconnects with his wife and children. His teaching becomes inspired, and his students begin enjoying class and respecting him. He even incorporates alcohol into his history lessons, engaging his heavy-drinking students. Encouraged by their success, the group decides to take the experiment further, increasing their BAC minimum to 0.10. Still feeling the benefits, they eventually push the boundaries further, deciding one night to drink to oblivion to test its liberating effects. However, after returning home incapacitated, both Martin and Nikolaj are confronted by their families. Martin's family expresses concern, revealing that they have known he has been drinking for weeks. He and his wife acknowledge their growing distance, and she admits to infidelity. The group abandons the experiment. Martin and his wife separate, and although he tries to make amends, she rejects him.

All members of the group stop drinking during the day, except for Tommy, whom the others try to support. However, at a faculty meeting where the headmaster reveals that teachers have been drinking at work, Tommy arrives visibly intoxicated. Later, he boards his boat while drunk, takes his old dog with him, motors out onto the bay, and ultimately goes overboard, drowning at sea.

After Tommy's funeral, the three remaining friends go out to dinner to celebrate his life, enjoying sparkling wine. While dining, Martin receives a text from his wife saying she misses him. As they sit by the harbour, recently graduated students pass by, celebrating in their customary drunken revelry. Martin, Peter, and Nikolaj join them in drinking and dancing. Martin, a former jazz ballet dancer, finally gives in to his colleagues' previous urgings and dances with the students. His movements grow increasingly energetic and joyous before he finishes his dance by spontaneously jumping into the sea. Four teacher friends start a social experiment in Thomas Vinterberg's smart and ultimately moving ""Another Round."" Based on a belief that the human body is born with too low an alcohol level, they strive to maintain a 0.05% BAC at all times-buzzed but far from drunk. They set rules. They can only drink during work hours (yes, as teachers). The idea is that a low-level buzz releases stress and tension in ways that nothing else can. To varying degrees, all four men are going through what could be called a midlife crisis, dissatisfied by the mundanity of daily life as teachers, but it's Martin (Mads Mikkelsen) who is in the deepest funk. He has lost all passion for teaching his history class, feels distant from his family, and can't find many reasons to get up. The social experiment breaks him out of his rut in a relatively predictable way, but Mikkelsen elevates what could have been another traditional message movie about living life to the fullest even after you think you've had your final drink.

Shortly after the experiment begins, Vinterberg stages a scene in Martin's classroom, where he's engaging with his students in a way he clearly hasn't in years. He's getting them involved with vibrant conversation and new ways to look at history. He's smiling in that very Mads way. What's brilliant about the scene is how Vinterberg and cinematographer Sturla Brandth Grøvlen replicate that slightly wobbly feeling that comes after just a strong drink or two. Martin is nowhere near blacking out or doing anything embarrassing, but the slightly unsteady camera swoops in for a close-up and then back out again in the inconsistent way that the world sometimes does after a couple glasses of wine-the filmmaking coming to life like how Martin is with his new buzz on life. It's indicative of the high craft on display here as the visual language subtly matches the character's journey.

Martin's colleagues (Thomas Bo Larsen, Magnus Millang, & Lars Ranthe-all effective) find similar success, at least at first. A music teacher encourages his students to sing more with their hearts and souls; a philosophy teacher catches onto the anxiety of one of his students in a way he may not have given his previously detached approach. Then the quartet starts to change the terms of the experiment, which everyone knows is a bad idea. If 0.05% works so well for Martin that he feels better even when he's sober, maybe he should go higher? They start pushing the envelope. Absinthe gets involved. As anyone who has tried it can tell you, Absinthe is almost always a bad idea. Trust me.  

""Another Round"" reaches beyond its set-up when it becomes a study in individuality. The experiment affects each of the four men differently, and everyone knows that a drunk night comes with a hungover morning. A student near the end gives an exam on the Kierkegaardian philosophies on anxiety and accepting fallibility and failure, which is what all midlife crisis films are about to a certain degree-coming to terms with mistakes after you realize you may be running out of time to correct them.  

The midsection of ""Another Round,"" wherein the guys open up and alter their experiment based on results, has a tendency to drag, but Vinterberg avoids cliché in this bulk of the film, thanks largely to casting his favorite leading man (Mikkelsen starred in the director's excellent ""The Hunt""). The ""Hannibal"" star is such a genuinely captivating actor-one of those performers who holds the camera like a movie star while also feeling completely realistic and in the moment at the same time. He doesn't hit a single false note in a film that really could have been all broad humor and wacky hijinks. Even as the final act starts to get a bit manipulative by stretching some previously established realism, Mikkelsen holds it together, and then he comes out literally swinging in one of the best final scenes of the year. It's such a jubilant moment that you may walk out of the theater feeling a little buzzed. ","At first glance, Another Round is a fascinating film. You begin watching it, thinking, ""Is there anything positive I will learn from this film?"" But as the film goes on, it becomes clear that the central message of the film, being in a constant but controlled stupor will benefit your life, is not sustainable. This message is conveyed mainly through Martin's transformation, which begins as personal and emotional stagnation and culminates in a completely new outlook on life.  

Early in the film, Martin seemed depressed but also detached from his career and family. Around 5:00 minutes, he struggles to lead his class through a lesson on Winston Churchill and appears mentally dissociated from both the material and his students. In fact, his lack of focus becomes so apparent that students begin correcting him on the lesson's historical details, most notably Malthe. This emotional detachment continues at home, where, at approximately 5:55, the film cuts to a solemn Martin. Although he is physically present at the table, you can tell Martin has completely given up on life. He barely engages in conversation with his wife or kids and appears emotionally distant. This scene establishes that Martin's depression is affecting all areas of his life.

A strong contrast happens later in the movie during the early stages of the alcohol experiment. Before entering his classroom, Martin tests his BAC (blood alcohol content) and reveals he is at a .047. Reflecting on what his group discussed, he is eager to see the effects. The camera then opens up to the classroom at around 1:03 in the second video, with Martin's demeanor toward his students changed. In the scene, Martin is much more relaxed, engaging with his students, and confident! He explains the lesson using an effective election metaphor, which gets many more students involved in the material.

The insight that allows Martin to grow is the realization that alcohol was never the true source of his confidence or his happiness. While the drinking lowered his anxiety and allowed him to reconnect to teaching, it created a nasty product in the end. The experiment revealed that all the qualities Martin thought he had lost were still inside him this whole time. By the end of the film, Martin realizes that real growth happens when you're actively engaged in life rather than escaping from it.",100.0,"Hi Daniel, 

This is a fantastic essay. You did a great job identifying Martin's initial state not just as ""sad,"" but as ""mentally disassociated"" and ""detached."" Also, your conclusion is a perfect summary of the film's existential theme. 

Excellent work. ",High,maximum
